{
  "$schema": "./source-catalog.schema.json",
  "catalogVersion": 1,
  "lastReviewedAt": "2026-07-13",
  "statusStatement": "Every entry is research only. No catalog entry has been downloaded, incorporated, redistributed, or loaded by the application.",
  "sources": [
    {
      "id": "quaternius-universal-base-characters",
      "name": "Universal Base Characters",
      "creator": "Quaternius",
      "categories": ["characters", "hair", "humanoid-rig"],
      "disposition": "preferred",
      "status": "candidate-not-downloaded",
      "incorporated": false,
      "homepageUrl": "https://quaternius.com/packs/universalbasecharacters.html",
      "acquisitionUrl": "https://quaternius.itch.io/universal-base-characters",
      "license": {
        "spdxId": "CC0-1.0",
        "proofUrl": "https://quaternius.com/packs/universalbasecharacters.html",
        "scopeNotes": "The official pack page labels the pack CC0. Reconfirm the included license file after acquisition."
      },
      "formats": ["glTF", "FBX"],
      "listedArchiveSize": "122 MB for the free Standard archive when reviewed",
      "proposedUse": "Canonical selected/near humanoid base, hair variants, and source for derived age and LOD variants.",
      "compatibilityNotes": "Six bases, twenty hairstyles, a shared humanoid rig, and approximately 13k triangles per base are advertised; the pack is designed for the Universal Animation Library.",
      "constraints": ["No purpose-built child or elder base", "Occupation clothing needs project-authored additions", "Benchmark skinning and texture budget before incorporation"],
      "downloadedAt": null,
      "archiveSha256": null,
      "runtimeFiles": []
    },
    {
      "id": "quaternius-universal-animation-library",
      "name": "Universal Animation Library",
      "creator": "Quaternius",
      "categories": ["animation", "humanoid-rig"],
      "disposition": "preferred",
      "status": "candidate-not-downloaded",
      "incorporated": false,
      "homepageUrl": "https://quaternius.com/packs/universalanimationlibrary.html",
      "acquisitionUrl": "https://quaternius.itch.io/universal-animation-library",
      "license": {
        "spdxId": "CC0-1.0",
        "proofUrl": "https://quaternius.com/packs/universalanimationlibrary.html",
        "scopeNotes": "The official pack page labels the animations CC0. Reconfirm the archive license after acquisition."
      },
      "formats": ["GLB", "FBX", "Blend"],
      "listedArchiveSize": "15 MB for the free Standard archive when reviewed",
      "proposedUse": "Curated in-place locomotion, social, carry, sit, injury, and death clips on the canonical humanoid rig.",
      "compatibilityNotes": "The official page advertises 120+ clips with root-motion and no-root-motion variants; version 3 and a July 2026 patch were visible when reviewed.",
      "constraints": ["Do not ship the complete library by default", "Simulation movement must not be driven by root motion", "Validate bone names and clip bounds"],
      "downloadedAt": null,
      "archiveSha256": null,
      "runtimeFiles": []
    },
    {
      "id": "quaternius-universal-animation-library-2",
      "name": "Universal Animation Library 2",
      "creator": "Quaternius",
      "categories": ["animation", "humanoid-rig", "work"],
      "disposition": "preferred",
      "status": "candidate-not-downloaded",
      "incorporated": false,
      "homepageUrl": "https://quaternius.com/packs/universalanimationlibrary2.html",
      "acquisitionUrl": "https://quaternius.itch.io/universal-animation-library-2",
      "license": {
        "spdxId": "CC0-1.0",
        "proofUrl": "https://quaternius.com/packs/universalanimationlibrary2.html",
        "scopeNotes": "The official pack page labels the animations CC0. Reconfirm the archive license after acquisition."
      },
      "formats": ["GLB", "FBX", "Blend"],
      "listedArchiveSize": "17 MB for the free Standard archive when reviewed",
      "proposedUse": "A small selection of farming, fishing, work, and other occupation clips missing from the first library.",
      "compatibilityNotes": "The official page advertises 130+ additional clips and root-motion/no-root-motion variants on the same universal rig.",
      "constraints": ["Curate only clips with visible simulation counterparts", "Retest contact points against project tools", "Validate July 2026 pack revision before pinning"],
      "downloadedAt": null,
      "archiveSha256": null,
      "runtimeFiles": []
    },
    {
      "id": "quaternius-downtown-city-megakit",
      "name": "Downtown City MegaKit",
      "creator": "Quaternius",
      "categories": ["buildings", "city", "modular"],
      "disposition": "preferred",
      "status": "candidate-not-downloaded",
      "incorporated": false,
      "homepageUrl": "https://quaternius.com/packs/downtowncitymegakit.html",
      "acquisitionUrl": "https://quaternius.itch.io/downtown-city-megakit",
      "license": {
        "spdxId": "CC0-1.0",
        "proofUrl": "https://quaternius.com/packs/downtowncitymegakit.html",
        "scopeNotes": "The official pack page labels the pack CC0. Reconfirm included notices after acquisition."
      },
      "formats": ["glTF", "FBX", "OBJ"],
      "listedArchiveSize": "223 MB for the free Standard archive when reviewed",
      "proposedUse": "Curated facade, roof, trim, and street-detail modules assembled by project-authored building logic.",
      "compatibilityNotes": "The official page advertises 300+ modular pieces, seven example buildings, and shared texture sets.",
      "constraints": ["Fake-window interiors are not functional interiors", "Project must generate collision and accessible doors", "Do not ship example cities or the whole archive"],
      "downloadedAt": null,
      "archiveSha256": null,
      "runtimeFiles": []
    },
    {
      "id": "quaternius-stylized-nature-megakit",
      "name": "Stylized Nature MegaKit",
      "creator": "Quaternius",
      "categories": ["nature", "vegetation", "rocks"],
      "disposition": "preferred",
      "status": "candidate-not-downloaded",
      "incorporated": false,
      "homepageUrl": "https://quaternius.itch.io/stylized-nature-megakit",
      "acquisitionUrl": "https://quaternius.itch.io/stylized-nature-megakit",
      "license": {
        "spdxId": "CC0-1.0",
        "proofUrl": "https://quaternius.itch.io/stylized-nature-megakit",
        "scopeNotes": "The official creator download page labels the pack CC0. Reconfirm included notices after acquisition."
      },
      "formats": ["glTF", "FBX", "OBJ"],
      "listedArchiveSize": "99 MB for the free Standard archive when reviewed",
      "proposedUse": "A coherent stylized nature family for instanced trees, plants, and rocks.",
      "compatibilityNotes": "The creator page advertises 116 models, including forty trees, thirty-five plants or flowers, and twenty-seven rocks.",
      "constraints": ["Benchmark alpha overdraw and instance count", "Create close, medium, far, and orbital variants", "Choose this or KayKit Forest as the primary nature language rather than mixing indiscriminately"],
      "downloadedAt": null,
      "archiveSha256": null,
      "runtimeFiles": []
    },
    {
      "id": "quaternius-ultimate-crops",
      "name": "Ultimate Crops Pack",
      "creator": "Quaternius",
      "categories": ["agriculture", "crops", "construction-stages"],
      "disposition": "supplemental",
      "status": "candidate-not-downloaded",
      "incorporated": false,
      "homepageUrl": "https://quaternius.com/packs/ultimatecrops.html",
      "acquisitionUrl": "https://quaternius.com/packs/ultimatecrops.html",
      "license": {
        "spdxId": "CC0-1.0",
        "proofUrl": "https://quaternius.com/packs/ultimatecrops.html",
        "scopeNotes": "The official pack page labels the pack CC0."
      },
      "formats": ["FBX", "OBJ", "Blend"],
      "listedArchiveSize": null,
      "proposedUse": "Visible crop growth stages tied directly to farm simulation state.",
      "compatibilityNotes": "The official page advertises 102 models and multiple crops in five growth stages; Blender conversion to GLB is required.",
      "constraints": ["No listed glTF download", "Atlas and LOD generation required", "Growth-stage timing remains simulation-owned"],
      "downloadedAt": null,
      "archiveSha256": null,
      "runtimeFiles": []
    },
    {
      "id": "quaternius-ultimate-home-interior",
      "name": "Ultimate Home Interior Pack",
      "creator": "Quaternius",
      "categories": ["interiors", "furniture", "doors"],
      "disposition": "supplemental",
      "status": "candidate-not-downloaded",
      "incorporated": false,
      "homepageUrl": "https://quaternius.com/packs/ultimatehomeinterior.html",
      "acquisitionUrl": "https://quaternius.com/packs/ultimatehomeinterior.html",
      "license": {
        "spdxId": "CC0-1.0",
        "proofUrl": "https://quaternius.com/packs/ultimatehomeinterior.html",
        "scopeNotes": "The official pack page labels the pack CC0."
      },
      "formats": ["FBX", "OBJ", "Blend"],
      "listedArchiveSize": null,
      "proposedUse": "Curated functional doors, windows, kitchen, bath, and furniture modules for accessible interiors.",
      "compatibilityNotes": "The official page advertises 123 interior assets; Blender conversion to GLB is required.",
      "constraints": ["Door clearance and pivots require validation", "Furniture placement must follow navigation clearance", "Do not populate inaccessible decorative rooms"],
      "downloadedAt": null,
      "archiveSha256": null,
      "runtimeFiles": []
    },
    {
      "id": "quaternius-public-transport",
      "name": "Public Transport Pack",
      "creator": "Quaternius",
      "categories": ["vehicles", "transportation"],
      "disposition": "supplemental",
      "status": "candidate-not-downloaded",
      "incorporated": false,